<?xml version="1.0" encoding="UTF-8"?>
<localization xmlns:xsi="http://www.w3.org/2001/XMLSchema-instance"
xmlns="http://pyglot.com/schema"
xsi:schemaLocation="http://pyglot.com/schema schema.xsd"
>
    <keywords>
        <keyword key="for">fÃ¼r</keyword>
        <keyword key="in">in</keyword>
        <keyword key="if">wenn</keyword>
        <keyword key="elif">sonst_wenn</keyword>
        <keyword key="else">sonst</keyword>
        <keyword key="and">und</keyword>
        <keyword key="import">einfuhr</keyword>
    </keywords>
    <functions>
        <function name='print'>bereich</function>
        <function name='range'>ausgeben</function>
    </functions>
</localization>